{
  "customerId": "C1001",
  "transactionId": "TX9001",
  "rootCause": {
    "status": "identified",
    "summary": "The wallet rejected the debit for attempt PA1 due to insufficient balance: requested 12,500 minor (INR 125.00) while available was 5,000 minor (INR 50.00). This decision (wallet.debit_rejected) propagated to the payment service (payment.declined, errorCode=INSUFFICIENT_BALANCE, httpStatus=422) and the checkout recorded a failure. Evidence from file, API, and database sources consistently show the rejection and no committed debit.",
    "evidenceIds": [
      "database:EV-0003",
      "api:EV-0004",
      "api:EV-0002",
      "file:EV-0001",
      "file:EV-0005"
    ],
    "limitations": [
      "No record in these sources shows a later successful retry within the provided time window.",
      "External wallet provider logs (beyond the internal wallet database decision) are not present; decision is taken from the wallet service database record.",
      "Clock ordering uses recorded timestamps; causality is inferred from explicit causedByEventId links rather than wall-clock order alone."
    ]
  },
  "failureFlow": [
    {
      "step": 1,
      "timestamp": "2026-09-14T10:00:00.000Z",
      "service": "checkout",
      "event": "checkout.started (attempt PA1)",
      "evidenceIds": [
        "file:EV-0001"
      ]
    },
    {
      "step": 2,
      "timestamp": "2026-09-14T10:00:00.070Z",
      "service": "payment",
      "event": "payment.received (payment attempt forwarded from checkout)",
      "evidenceIds": [
        "api:EV-0002"
      ]
    },
    {
      "step": 3,
      "timestamp": "2026-09-14T10:00:00.085Z",
      "service": "wallet",
      "event": "wallet.debit_rejected (decision: REJECTED; requestedMinor=12500, availableMinor=5000, currency=INR; debitCommitted=false)",
      "evidenceIds": [
        "database:EV-0003"
      ]
    },
    {
      "step": 4,
      "timestamp": "2026-09-14T10:00:00.090Z",
      "service": "payment",
      "event": "payment.declined (errorCode=INSUFFICIENT_BALANCE, httpStatus=422)",
      "evidenceIds": [
        "api:EV-0004"
      ]
    },
    {
      "step": 5,
      "timestamp": "2026-09-14T10:00:00.100000Z",
      "service": "checkout",
      "event": "checkout.failed (checkout recorded failure after payment response)",
      "evidenceIds": [
        "file:EV-0005"
      ]
    }
  ],
  "evidence": [
    {
      "evidenceId": "file:EV-0001",
      "source": "file",
      "locator": "file:logs/checkout.jsonl:1",
      "traceId": "00000000000000000000232900000001",
      "timestamp": "2026-09-14T10:00:00.000Z",
      "excerpt": "{\"attemptId\": \"PA1\", \"attributes\": {}, \"customerId\": \"C1001\", \"eventId\": \"EV-0001\", \"eventType\": \"checkout.started\", \"message\": \"Checkout started.\", \"parentSpanId\": null, \"service\": \"checkout\", \"spanId\": null, \"timestamp\": \"2026-09-14T10:00:00Z\", \"traceId\": \"00000000000000000000232900000001\", \"transactionId\": \"TX9001\"}"
    },
    {
      "evidenceId": "file:EV-0005",
      "source": "file",
      "locator": "file:logs/checkout.jsonl:2",
      "traceId": "00000000000000000000232900000001",
      "timestamp": "2026-09-14T10:00:00.100Z",
      "excerpt": "{\"attemptId\": \"PA1\", \"attributes\": {\"causedByEventId\": \"EV-0004\", \"transactionStatus\": \"FAILED\"}, \"customerId\": \"C1001\", \"eventId\": \"EV-0005\", \"eventType\": \"checkout.failed\", \"message\": \"Checkout failed after payment response.\", \"parentSpanId\": null, \"service\": \"checkout\", \"spanId\": null, \"timestamp\": \"2026-09-14T10:00:00.100000Z\", \"traceId\": \"00000000000000000000232900000001\", \"transactionId\": \"TX9001\"}"
    },
    {
      "evidenceId": "api:EV-0002",
      "source": "api",
      "locator": "api:payment-events/snapshot=9da4bc529af6/index=0",
      "traceId": "00000000000000000000232900000001",
      "timestamp": "2026-09-14T10:00:00.070Z",
      "excerpt": "{\"attemptId\": \"PA1\", \"attributes\": {\"causedByEventId\": \"EV-0001\"}, \"customerId\": \"C1001\", \"eventId\": \"EV-0002\", \"eventType\": \"payment.received\", \"message\": \"Payment attempt received.\", \"parentSpanId\": null, \"service\": \"payment\", \"spanId\": null, \"timestamp\": \"2026-09-14T10:00:00.070000Z\", \"traceId\": \"00000000000000000000232900000001\", \"transactionId\": \"TX9001\"}"
    },
    {
      "evidenceId": "api:EV-0004",
      "source": "api",
      "locator": "api:payment-events/snapshot=9da4bc529af6/index=1",
      "traceId": "00000000000000000000232900000001",
      "timestamp": "2026-09-14T10:00:00.090Z",
      "excerpt": "{\"attemptId\": \"PA1\", \"attributes\": {\"causedByEventId\": \"EV-0003\", \"errorCode\": \"INSUFFICIENT_BALANCE\", \"httpStatus\": 422}, \"customerId\": \"C1001\", \"eventId\": \"EV-0004\", \"eventType\": \"payment.declined\", \"message\": \"Wallet rejected this debit attempt.\", \"parentSpanId\": null, \"service\": \"payment\", \"spanId\": null, \"timestamp\": \"2026-09-14T10:00:00.090000Z\", \"traceId\": \"00000000000000000000232900000001\", \"transactionId\": \"TX9001\"}"
    },
    {
      "evidenceId": "database:EV-0003",
      "source": "database",
      "locator": "database:transactions.db/events/event_id=EV-0003",
      "traceId": "00000000000000000000232900000001",
      "timestamp": "2026-09-14T10:00:00.085Z",
      "excerpt": "{\"attemptId\": \"PA1\", \"attributes\": {\"availableMinor\": 5000, \"causedByEventId\": \"EV-0002\", \"currency\": \"INR\", \"debitCommitted\": false, \"decision\": \"REJECTED\", \"errorCode\": \"INSUFFICIENT_BALANCE\", \"requestedMinor\": 12500}, \"customerId\": \"C1001\", \"eventId\": \"EV-0003\", \"eventType\": \"wallet.debit_rejected\", \"message\": \"Debit rejected at decision time.\", \"parentSpanId\": null, \"service\": \"wallet\", \"spanId\": null, \"timestamp\": \"2026-09-14T10:00:00.085000Z\", \"traceId\": \"00000000000000000000232900000001\", \"transactionId\": \"TX9001\"}"
    }
  ],
  "recommendation": [
    {
      "action": "Show a clear 'Insufficient funds' message and next steps to the customer (include required amount and their available balance).",
      "reason": "The wallet decision shows requestedMinor=12500 (INR 125.00) and availableMinor=5000 (INR 50.00), so the customer must add funds or choose another payment method to complete the purchase.",
      "evidenceIds": [
        "database:EV-0003",
        "api:EV-0004",
        "file:EV-0005"
      ]
    },
    {
      "action": "If applicable, offer alternative payment methods or an explicit 'add funds' / top-up flow from the checkout UI.",
      "reason": "Debit was rejected by the wallet due to insufficient balance; providing alternatives reduces abandonment.",
      "evidenceIds": [
        "database:EV-0003"
      ]
    },
    {
      "action": "Log and monitor counts of INSUFFICIENT_BALANCE declines and surface to payments/finance teams for potential UX or product changes.",
      "reason": "The decline is a business decision (INSUFFICIENT_BALANCE) recorded in the wallet; trending could indicate need for customer education or UX changes.",
      "evidenceIds": [
        "api:EV-0004",
        "database:EV-0003"
      ]
    },
    {
      "action": "If reconciliation or dispute is needed, provide database:EV-0003 (wallet decision) and api:EV-0004 (payment decline) to financial operations as authoritative records that no debitCommitted occurred.",
      "reason": "database:EV-0003 includes debitCommitted=false and decision=REJECTED; those are required to prove no funds were taken.",
      "evidenceIds": [
        "database:EV-0003",
        "api:EV-0004"
      ]
    }
  ]
}