{
  "customerId": "C1001",
  "transactionId": "TX9004",
  "rootCause": {
    "status": "no_failure",
    "summary": "Checkout completed successfully: the checkout service started and recorded completion (file:EV-0015 -> file:EV-0019). The payment was received by the payment service (api:EV-0016), recorded as committed in the ledger (database:EV-0017), and the payment service reported success with HTTP 200 (api:EV-0018). All three data sources (file, api, database) contain a consistent causal chain for attempt PA1 within the investigation window, supporting that the transaction succeeded.",
    "evidenceIds": [
      "file:EV-0015",
      "api:EV-0016",
      "database:EV-0017",
      "api:EV-0018",
      "file:EV-0019"
    ],
    "limitations": [
      "No external acquirer/settlement network logs available here \u2014 ledger commit (database:EV-0017) is the strongest internal evidence of settlement but does not prove final settlement at an external PSP.",
      "Timestamps derive from service records; small clock skew between services is possible but does not conflict with the observed causal sequence.",
      "Investigation limited to the provided time window and the recorded trace/attempt (PA1)."
    ]
  },
  "failureFlow": [
    {
      "step": 1,
      "timestamp": "2026-09-14T10:00:00Z",
      "service": "checkout",
      "event": "checkout.started \u2014 Checkout started for TX9004 (attempt PA1).",
      "evidenceIds": [
        "file:EV-0015"
      ]
    },
    {
      "step": 2,
      "timestamp": "2026-09-14T10:00:00.070000Z",
      "service": "payment",
      "event": "payment.received \u2014 Payment attempt received by payment service (causedByEventId EV-0015).",
      "evidenceIds": [
        "api:EV-0016"
      ]
    },
    {
      "step": 3,
      "timestamp": "2026-09-14T10:00:00.085000Z",
      "service": "ledger",
      "event": "payment.committed \u2014 Ledger recorded decision COMMITTED (causedByEventId EV-0016).",
      "evidenceIds": [
        "database:EV-0017"
      ]
    },
    {
      "step": 4,
      "timestamp": "2026-09-14T10:00:00.090000Z",
      "service": "payment",
      "event": "payment.succeeded \u2014 Payment service reported success (httpStatus 200, causedByEventId EV-0017).",
      "evidenceIds": [
        "api:EV-0018"
      ]
    },
    {
      "step": 5,
      "timestamp": "2026-09-14T10:00:00.100000Z",
      "service": "checkout",
      "event": "checkout.succeeded \u2014 Checkout completed and transaction marked SUCCEEDED (causedByEventId EV-0018).",
      "evidenceIds": [
        "file:EV-0019"
      ]
    }
  ],
  "evidence": [
    {
      "evidenceId": "file:EV-0015",
      "source": "file",
      "locator": "file:logs/checkout.jsonl:7",
      "traceId": "00000000000000000000232c00000001",
      "timestamp": "2026-09-14T10:00:00.000Z",
      "excerpt": "{\"attemptId\": \"PA1\", \"attributes\": {}, \"customerId\": \"C1001\", \"eventId\": \"EV-0015\", \"eventType\": \"checkout.started\", \"message\": \"Checkout started.\", \"parentSpanId\": null, \"service\": \"checkout\", \"spanId\": null, \"timestamp\": \"2026-09-14T10:00:00Z\", \"traceId\": \"00000000000000000000232c00000001\", \"transactionId\": \"TX9004\"}"
    },
    {
      "evidenceId": "api:EV-0016",
      "source": "api",
      "locator": "api:payment-events/snapshot=9da4bc529af6/index=6",
      "traceId": "00000000000000000000232c00000001",
      "timestamp": "2026-09-14T10:00:00.070Z",
      "excerpt": "{\"attemptId\": \"PA1\", \"attributes\": {\"causedByEventId\": \"EV-0015\"}, \"customerId\": \"C1001\", \"eventId\": \"EV-0016\", \"eventType\": \"payment.received\", \"message\": \"Payment attempt received.\", \"parentSpanId\": null, \"service\": \"payment\", \"spanId\": null, \"timestamp\": \"2026-09-14T10:00:00.070000Z\", \"traceId\": \"00000000000000000000232c00000001\", \"transactionId\": \"TX9004\"}"
    },
    {
      "evidenceId": "database:EV-0017",
      "source": "database",
      "locator": "database:transactions.db/events/event_id=EV-0017",
      "traceId": "00000000000000000000232c00000001",
      "timestamp": "2026-09-14T10:00:00.085Z",
      "excerpt": "{\"attemptId\": \"PA1\", \"attributes\": {\"causedByEventId\": \"EV-0016\", \"decision\": \"COMMITTED\"}, \"customerId\": \"C1001\", \"eventId\": \"EV-0017\", \"eventType\": \"payment.committed\", \"message\": \"Payment committed.\", \"parentSpanId\": null, \"service\": \"ledger\", \"spanId\": null, \"timestamp\": \"2026-09-14T10:00:00.085000Z\", \"traceId\": \"00000000000000000000232c00000001\", \"transactionId\": \"TX9004\"}"
    },
    {
      "evidenceId": "api:EV-0018",
      "source": "api",
      "locator": "api:payment-events/snapshot=9da4bc529af6/index=7",
      "traceId": "00000000000000000000232c00000001",
      "timestamp": "2026-09-14T10:00:00.090Z",
      "excerpt": "{\"attemptId\": \"PA1\", \"attributes\": {\"causedByEventId\": \"EV-0017\", \"httpStatus\": 200}, \"customerId\": \"C1001\", \"eventId\": \"EV-0018\", \"eventType\": \"payment.succeeded\", \"message\": \"Payment accepted.\", \"parentSpanId\": null, \"service\": \"payment\", \"spanId\": null, \"timestamp\": \"2026-09-14T10:00:00.090000Z\", \"traceId\": \"00000000000000000000232c00000001\", \"transactionId\": \"TX9004\"}"
    },
    {
      "evidenceId": "file:EV-0019",
      "source": "file",
      "locator": "file:logs/checkout.jsonl:8",
      "traceId": "00000000000000000000232c00000001",
      "timestamp": "2026-09-14T10:00:00.100Z",
      "excerpt": "{\"attemptId\": \"PA1\", \"attributes\": {\"causedByEventId\": \"EV-0018\", \"transactionStatus\": \"SUCCEEDED\"}, \"customerId\": \"C1001\", \"eventId\": \"EV-0019\", \"eventType\": \"checkout.succeeded\", \"message\": \"Checkout completed.\", \"parentSpanId\": null, \"service\": \"checkout\", \"spanId\": null, \"timestamp\": \"2026-09-14T10:00:00.100000Z\", \"traceId\": \"00000000000000000000232c00000001\", \"transactionId\": \"TX9004\"}"
    }
  ],
  "recommendation": [
    {
      "action": "Confirm external settlement/reconciliation with payment provider (PSP) or acquirer for TX9004 if your financial process requires PSP confirmation.",
      "reason": "Internal ledger shows COMMITTED (database:EV-0017) and payment service reported HTTP 200 (api:EV-0018), but external settlement logs are not present in the collected evidence.",
      "evidenceIds": [
        "database:EV-0017",
        "api:EV-0018"
      ]
    },
    {
      "action": "Record or archive the successful transaction in merchant reporting and notify downstream systems that rely on ledger commit.",
      "reason": "Checkout and payment sequence completed and ledger commit recorded, supporting downstream fulfillment or order processing.",
      "evidenceIds": [
        "file:EV-0019",
        "database:EV-0017"
      ]
    },
    {
      "action": "If you require higher assurance, instrument and collect PSP/acquirer callbacks or settlement confirmations into the same trace for future end-to-end proof.",
      "reason": "This will remove the remaining limitation about external settlement visibility noted in the root-cause limitations.",
      "evidenceIds": []
    }
  ]
}