{
  "customerId": "C1001",
  "transactionId": "TX9003",
  "rootCause": {
    "status": "suspected",
    "summary": "The payment attempt for TX9003 timed out waiting for an upstream payment provider (payment service recorded an UPSTREAM_TIMEOUT with HTTP 504), and that timeout propagated to the checkout service, causing the checkout to fail. Provider-side details (gateway logs/audit) are not present in the available database/audit sources, so the exact reason for the upstream timeout (provider outage, network, or gateway rejection) cannot be determined from the collected evidence.",
    "evidenceIds": [
      "file:EV-0011",
      "api:EV-0012",
      "api:EV-0013",
      "file:EV-0014"
    ],
    "limitations": [
      "No provider/gateway logs or database audit rows were returned for this attempt (database query returned no matching records). Missing upstream provider details prevents definitive identification of the root cause of the 504 timeout.",
      "A 504/UPSTREAM_TIMEOUT is a symptom; available records show the timeout occurred but do not show whether the provider returned an error, dropped the request, or whether a network/relay issue caused the timeout.",
      "Clock/timestamp ordering is used only for display chronology; causal assertions are based on explicit causedByEventId links in the records but deeper infrastructure traces are absent."
    ]
  },
  "failureFlow": [
    {
      "step": 1,
      "timestamp": "2026-09-14T10:00:00Z",
      "service": "checkout",
      "event": "checkout.started \u2014 Checkout started.",
      "evidenceIds": [
        "file:EV-0011"
      ]
    },
    {
      "step": 2,
      "timestamp": "2026-09-14T10:00:00.070000Z",
      "service": "payment",
      "event": "payment.received \u2014 Payment attempt received.",
      "evidenceIds": [
        "api:EV-0012"
      ]
    },
    {
      "step": 3,
      "timestamp": "2026-09-14T10:00:00.090000Z",
      "service": "payment",
      "event": "payment.timeout \u2014 Upstream payment request timed out (errorCode=UPSTREAM_TIMEOUT, httpStatus=504).",
      "evidenceIds": [
        "api:EV-0013"
      ]
    },
    {
      "step": 4,
      "timestamp": "2026-09-14T10:00:00.100000Z",
      "service": "checkout",
      "event": "checkout.failed \u2014 Checkout failed after payment response.",
      "evidenceIds": [
        "file:EV-0014"
      ]
    }
  ],
  "evidence": [
    {
      "evidenceId": "file:EV-0011",
      "source": "file",
      "locator": "file:logs/checkout.jsonl:5",
      "traceId": "00000000000000000000232b00000001",
      "timestamp": "2026-09-14T10:00:00.000Z",
      "excerpt": "{\"attemptId\": \"PA1\", \"attributes\": {}, \"customerId\": \"C1001\", \"eventId\": \"EV-0011\", \"eventType\": \"checkout.started\", \"message\": \"Checkout started.\", \"parentSpanId\": null, \"service\": \"checkout\", \"spanId\": null, \"timestamp\": \"2026-09-14T10:00:00Z\", \"traceId\": \"00000000000000000000232b00000001\", \"transactionId\": \"TX9003\"}"
    },
    {
      "evidenceId": "api:EV-0012",
      "source": "api",
      "locator": "api:payment-events/snapshot=9da4bc529af6/index=4",
      "traceId": "00000000000000000000232b00000001",
      "timestamp": "2026-09-14T10:00:00.070Z",
      "excerpt": "{\"attemptId\": \"PA1\", \"attributes\": {\"causedByEventId\": \"EV-0011\"}, \"customerId\": \"C1001\", \"eventId\": \"EV-0012\", \"eventType\": \"payment.received\", \"message\": \"Payment attempt received.\", \"parentSpanId\": null, \"service\": \"payment\", \"spanId\": null, \"timestamp\": \"2026-09-14T10:00:00.070000Z\", \"traceId\": \"00000000000000000000232b00000001\", \"transactionId\": \"TX9003\"}"
    },
    {
      "evidenceId": "api:EV-0013",
      "source": "api",
      "locator": "api:payment-events/snapshot=9da4bc529af6/index=5",
      "traceId": "00000000000000000000232b00000001",
      "timestamp": "2026-09-14T10:00:00.090Z",
      "excerpt": "{\"attemptId\": \"PA1\", \"attributes\": {\"causedByEventId\": \"EV-0012\", \"errorCode\": \"UPSTREAM_TIMEOUT\", \"httpStatus\": 504}, \"customerId\": \"C1001\", \"eventId\": \"EV-0013\", \"eventType\": \"payment.timeout\", \"message\": \"Upstream payment request timed out; provider details absent.\", \"parentSpanId\": null, \"service\": \"payment\", \"spanId\": null, \"timestamp\": \"2026-09-14T10:00:00.090000Z\", \"traceId\": \"00000000000000000000232b00000001\", \"transactionId\": \"TX9003\"}"
    },
    {
      "evidenceId": "file:EV-0014",
      "source": "file",
      "locator": "file:logs/checkout.jsonl:6",
      "traceId": "00000000000000000000232b00000001",
      "timestamp": "2026-09-14T10:00:00.100Z",
      "excerpt": "{\"attemptId\": \"PA1\", \"attributes\": {\"causedByEventId\": \"EV-0013\", \"transactionStatus\": \"FAILED\"}, \"customerId\": \"C1001\", \"eventId\": \"EV-0014\", \"eventType\": \"checkout.failed\", \"message\": \"Checkout failed after payment response.\", \"parentSpanId\": null, \"service\": \"checkout\", \"spanId\": null, \"timestamp\": \"2026-09-14T10:00:00.100000Z\", \"traceId\": \"00000000000000000000232b00000001\", \"transactionId\": \"TX9003\"}"
    }
  ],
  "recommendation": [
    {
      "action": "Request upstream provider/gateway logs for the timeframe around 2026-09-14T10:00:00Z for attempt PA1 (correlate on transaction or provider request id if available).",
      "reason": "The payment service recorded an UPSTREAM_TIMEOUT (httpStatus=504) but provider-side logs are missing from the collected data; those logs are required to determine whether the provider rejected the request, experienced an outage, or there was a network relay issue.",
      "evidenceIds": [
        "api:EV-0013"
      ]
    },
    {
      "action": "Check payment gateway audit/database for any recorded transaction/posting for PA1 and reconcile with customer billing.",
      "reason": "To ensure the customer was not charged despite the timeout and to enable correct remediation (refund or confirmation) if a provider later processed the charge.",
      "evidenceIds": [
        "api:EV-0013",
        "file:EV-0014"
      ]
    },
    {
      "action": "Instrument/add retention of provider response details and gateway request IDs into the payment audit table (or ensure they are persisted) so future timeouts include provider correlation information.",
      "reason": "Recorded evidence shows 'provider details absent' in the payment.timeout record; persisting provider response/IDs will allow definitive root-cause identification for upstream timeouts.",
      "evidenceIds": [
        "api:EV-0013"
      ]
    },
    {
      "action": "If this customer experienced a visible failure, notify them with clear guidance (e.g., payment may not have completed; we are investigating) and avoid automatic financial retries without idempotency guarantees.",
      "reason": "The checkout failed after a payment timeout; retries without idempotency or confirmation from provider could risk duplicate charges.",
      "evidenceIds": [
        "file:EV-0014",
        "api:EV-0013"
      ]
    }
  ]
}